[
  {
    "clueId": "ct.population.3_5-4m",
    "answerStateId": "US-CT",
    "category": "population",
    "render": {
      "kind": "text",
      "text": {
        "en": "About 3.5–4 million people lived here in 2025."
      }
    },
    "factRefs": [
      "us-states-2026-09-06-v1:US-CT:population.resident_estimate"
    ],
    "predicate": {
      "metricId": "population.resident_estimate",
      "op": "between",
      "minInclusive": 3500000,
      "maxExclusive": 4000000
    },
    "candidateSet": {
      "snapshotId": "us-states-2026-09-06-v1",
      "stateIds": [
        "US-CT",
        "US-UT"
      ],
      "count": 2,
      "computedAt": "2026-09-06T00:09:09.920Z",
      "evaluatorVersion": "clue-ladder-1"
    },
    "difficulty": {
      "seedTier": 2,
      "knowledgePrior": "general",
      "directness": "indirect",
      "calibrationStatus": "editorial_seed"
    },
    "ladderPolicy": {
      "earliestRung": 1,
      "latestRung": 3,
      "dependencyGroup": "CT:population:2025"
    },
    "freshness": {
      "class": "annual",
      "referenceLabelRequired": true
    },
    "review": {
      "status": "draft",
      "evidenceChecked": true,
      "wordingChecked": true,
      "fairnessChecked": false,
      "notes": "Batch 01 handoff POP25 / R. Fresh 50-state candidate evaluation matches. Alternative retained for later fairness review."
    }
  },
  {
    "clueId": "ct.area.rank-46-50",
    "answerStateId": "US-CT",
    "category": "area",
    "render": {
      "kind": "text",
      "text": {
        "en": "It ranks among the five smallest states by land area. (2010 Census)"
      }
    },
    "factRefs": [
      "us-states-2026-09-06-v1:US-CT:area.land_rank"
    ],
    "predicate": {
      "metricId": "area.land_rank",
      "op": "between",
      "minInclusive": 46,
      "maxExclusive": 51
    },
    "candidateSet": {
      "snapshotId": "us-states-2026-09-06-v1",
      "stateIds": [
        "US-CT",
        "US-DE",
        "US-HI",
        "US-NJ",
        "US-RI"
      ],
      "count": 5,
      "computedAt": "2026-09-06T00:09:09.920Z",
      "evaluatorVersion": "clue-ladder-1"
    },
    "difficulty": {
      "seedTier": 3,
      "knowledgePrior": "general",
      "directness": "indirect",
      "calibrationStatus": "editorial_seed"
    },
    "ladderPolicy": {
      "earliestRung": 4,
      "latestRung": 4,
      "dependencyGroup": "CT:area:2010"
    },
    "freshness": {
      "class": "static",
      "referenceLabelRequired": false
    },
    "review": {
      "status": "approved",
      "evidenceChecked": true,
      "wordingChecked": true,
      "fairnessChecked": true,
      "notes": "Batch 01 handoff AREA10 / R. Fresh 50-state candidate evaluation matches. Seven-round order reviewed for local playtesting; early uniqueness is not measured player difficulty."
    }
  },
  {
    "clueId": "ct.highpoint.2000-2500",
    "answerStateId": "US-CT",
    "category": "physical_geography",
    "render": {
      "kind": "text",
      "text": {
        "en": "Its highest point is 2,000–2,500 feet high."
      }
    },
    "factRefs": [
      "us-states-2026-09-06-v1:US-CT:physical.highest_point"
    ],
    "predicate": {
      "metricId": "physical.highest_point",
      "op": "between",
      "minInclusive": 2000,
      "maxExclusive": 2500
    },
    "candidateSet": {
      "snapshotId": "us-states-2026-09-06-v1",
      "stateIds": [
        "US-AL",
        "US-CT",
        "US-MN"
      ],
      "count": 3,
      "computedAt": "2026-09-06T00:09:09.920Z",
      "evaluatorVersion": "clue-ladder-1"
    },
    "difficulty": {
      "seedTier": 3,
      "knowledgePrior": "specialized",
      "directness": "indirect",
      "calibrationStatus": "editorial_seed"
    },
    "ladderPolicy": {
      "earliestRung": 5,
      "latestRung": 5,
      "dependencyGroup": "CT:elevation"
    },
    "freshness": {
      "class": "static",
      "referenceLabelRequired": false
    },
    "review": {
      "status": "approved",
      "evidenceChecked": true,
      "wordingChecked": true,
      "fairnessChecked": true,
      "notes": "Batch 01 handoff ELEV / R. Fresh 50-state candidate evaluation matches. Seven-round order reviewed for local playtesting; early uniqueness is not measured player difficulty."
    }
  },
  {
    "clueId": "ct.time.eastern-all",
    "answerStateId": "US-CT",
    "category": "time_zone",
    "render": {
      "kind": "text",
      "text": {
        "en": "The whole state uses Eastern Time. (2026 rules)"
      }
    },
    "factRefs": [
      "us-states-2026-09-06-v1:US-CT:time.standard_zone"
    ],
    "predicate": {
      "metricId": "time.standard_zone",
      "op": "eq",
      "value": [
        "Eastern"
      ]
    },
    "candidateSet": {
      "snapshotId": "us-states-2026-09-06-v1",
      "stateIds": [
        "US-CT",
        "US-DE",
        "US-GA",
        "US-MA",
        "US-MD",
        "US-ME",
        "US-NC",
        "US-NH",
        "US-NJ",
        "US-NY",
        "US-OH",
        "US-PA",
        "US-RI",
        "US-SC",
        "US-VA",
        "US-VT",
        "US-WV"
      ],
      "count": 17,
      "computedAt": "2026-09-06T00:09:09.920Z",
      "evaluatorVersion": "clue-ladder-1"
    },
    "difficulty": {
      "seedTier": 4,
      "knowledgePrior": "general",
      "directness": "indirect",
      "calibrationStatus": "editorial_seed"
    },
    "ladderPolicy": {
      "earliestRung": 3,
      "latestRung": 3,
      "dependencyGroup": "CT:time:2026"
    },
    "freshness": {
      "class": "regulatory",
      "referenceLabelRequired": true
    },
    "review": {
      "status": "approved",
      "evidenceChecked": true,
      "wordingChecked": true,
      "fairnessChecked": true,
      "notes": "Batch 01 handoff TIME26 / R. Fresh 50-state candidate evaluation matches. Seven-round order reviewed for local playtesting; early uniqueness is not measured player difficulty."
    }
  },
  {
    "clueId": "ct.parks.formal-0",
    "answerStateId": "US-CT",
    "category": "parks",
    "render": {
      "kind": "text",
      "text": {
        "en": "It has no formally designated National Park. (NPS, 2026)"
      }
    },
    "factRefs": [
      "us-states-2026-09-06-v1:US-CT:nps.formal_national_park_count"
    ],
    "predicate": {
      "metricId": "nps.formal_national_park_count",
      "op": "eq",
      "value": 0
    },
    "candidateSet": {
      "snapshotId": "us-states-2026-09-06-v1",
      "stateIds": [
        "US-AL",
        "US-CT",
        "US-DE",
        "US-GA",
        "US-IA",
        "US-KS",
        "US-LA",
        "US-MA",
        "US-MD",
        "US-MS",
        "US-NE",
        "US-NH",
        "US-NJ",
        "US-NY",
        "US-OK",
        "US-PA",
        "US-RI",
        "US-VT",
        "US-WI"
      ],
      "count": 19,
      "computedAt": "2026-09-06T00:09:09.920Z",
      "evaluatorVersion": "clue-ladder-1"
    },
    "difficulty": {
      "seedTier": 5,
      "knowledgePrior": "specialized",
      "directness": "indirect",
      "calibrationStatus": "editorial_seed"
    },
    "ladderPolicy": {
      "earliestRung": 2,
      "latestRung": 2,
      "dependencyGroup": "CT:parks:2026"
    },
    "freshness": {
      "class": "event_driven",
      "referenceLabelRequired": true
    },
    "review": {
      "status": "approved",
      "evidenceChecked": true,
      "wordingChecked": true,
      "fairnessChecked": true,
      "notes": "Batch 01 handoff NPS26 / R. Fresh 50-state candidate evaluation matches. Seven-round order reviewed for local playtesting; early uniqueness is not measured player difficulty."
    }
  },
  {
    "clueId": "ct.history.1788",
    "answerStateId": "US-CT",
    "category": "history",
    "render": {
      "kind": "text",
      "text": {
        "en": "It joined the Union in 1788."
      }
    },
    "factRefs": [
      "us-states-2026-09-06-v1:US-CT:history.admission_year"
    ],
    "predicate": {
      "metricId": "history.admission_year",
      "op": "eq",
      "value": 1788
    },
    "candidateSet": {
      "snapshotId": "us-states-2026-09-06-v1",
      "stateIds": [
        "US-CT",
        "US-GA",
        "US-MA",
        "US-MD",
        "US-NH",
        "US-NY",
        "US-SC",
        "US-VA"
      ],
      "count": 8,
      "computedAt": "2026-09-06T00:09:09.920Z",
      "evaluatorVersion": "clue-ladder-1"
    },
    "difficulty": {
      "seedTier": 4,
      "knowledgePrior": "specialized",
      "directness": "indirect",
      "calibrationStatus": "editorial_seed"
    },
    "ladderPolicy": {
      "earliestRung": 1,
      "latestRung": 1,
      "dependencyGroup": "CT:admission"
    },
    "freshness": {
      "class": "static",
      "referenceLabelRequired": false
    },
    "review": {
      "status": "approved",
      "evidenceChecked": true,
      "wordingChecked": true,
      "fairnessChecked": true,
      "notes": "Batch 01 handoff GUIDE / R. Fresh 50-state candidate evaluation matches. Seven-round order reviewed for local playtesting; early uniqueness is not measured player difficulty."
    }
  },
  {
    "clueId": "ct.cities.top2-2025",
    "answerStateId": "US-CT",
    "category": "cities",
    "render": {
      "kind": "text",
      "text": {
        "en": "Bridgeport and Stamford were its two largest incorporated places in 2025."
      }
    },
    "factRefs": [
      "us-states-2026-09-06-v1:US-CT:place.batch01_membership",
      "us-states-2026-09-06-v1:US-CT:place.top_two"
    ],
    "predicate": {
      "all": [
        {
          "metricId": "place.batch01_membership",
          "op": "contains_all",
          "values": [
            "place:CT:bridgeport-city",
            "place:CT:stamford-city"
          ]
        },
        {
          "metricId": "place.top_two",
          "op": "contains_all",
          "values": [
            "place:CT:bridgeport-city",
            "place:CT:stamford-city"
          ]
        }
      ]
    },
    "candidateSet": {